{
  "owsf_version": "1.0",
  "doc_id": "owsf_agent_loop_demo_2026_08_10_001",
  "created_at": "2026-08-10T09:00:00Z",
  "producer": {
    "name": "wsm",
    "version": "0.1.0"
  },
  "dispatched_from": {
    "parent_doc_id": "owsf_orchestrator_2026_08_10_000",
    "parent_event_id": "evt_dispatch_042"
  },
  "writers": [
    {
      "writer_id": "wsm:agent",
      "name": "example agent recorder"
    }
  ],
  "spaces": [
    {
      "id": "root",
      "type": "filesystem",
      "parent": null,
      "boundary": {
        "kind": "local_path",
        "ref": "/workspace"
      },
      "capabilities": [
        "read",
        "write"
      ],
      "trust_level": "trusted"
    }
  ],
  "events": [
    {
      "event_id": "evt_001",
      "writer_id": "wsm:agent",
      "space_id": "root",
      "type": "topology.space_create",
      "lamport": 1,
      "seq": 1,
      "timestamp": "2026-08-10T09:00:00Z",
      "payload": {
        "space_id": "root",
        "note": "root workspace"
      }
    },
    {
      "event_id": "evt_002",
      "writer_id": "wsm:agent",
      "space_id": "root",
      "type": "session.start",
      "lamport": 2,
      "seq": 2,
      "timestamp": "2026-08-10T09:00:01Z",
      "depends_on": [
        "evt_001"
      ],
      "payload": {
        "session_id": "sess_2026_08_10_001",
        "title": "Fix flaky auth test",
        "model": "example-model-1"
      }
    },
    {
      "event_id": "evt_003",
      "writer_id": "wsm:agent",
      "space_id": "root",
      "type": "context.inject",
      "lamport": 3,
      "seq": 3,
      "timestamp": "2026-08-10T09:00:02Z",
      "depends_on": [
        "evt_002"
      ],
      "payload": {
        "source_doc_id": "owsf_agent_loop_demo_2026_08_09_007",
        "from_event_id": "evt_040",
        "to_event_id": "evt_052",
        "content": "Prior session diagnosis: auth test flakiness correlates with unseeded RNG in test fixtures."
      }
    },
    {
      "event_id": "evt_004",
      "writer_id": "wsm:agent",
      "space_id": "root",
      "type": "message.user",
      "lamport": 4,
      "seq": 4,
      "timestamp": "2026-08-10T09:00:05Z",
      "depends_on": [
        "evt_003"
      ],
      "payload": {
        "content": "The auth test fails intermittently in CI. Can you find out why?"
      }
    },
    {
      "event_id": "evt_005",
      "writer_id": "wsm:agent",
      "space_id": "root",
      "type": "message.assistant",
      "lamport": 5,
      "seq": 5,
      "timestamp": "2026-08-10T09:00:09Z",
      "depends_on": [
        "evt_004"
      ],
      "payload": {
        "content": "I will read the test file first to look for order or timing dependence.",
        "model": "example-model-1",
        "stop_reason": "tool_use"
      }
    },
    {
      "event_id": "evt_006",
      "writer_id": "wsm:agent",
      "space_id": "root",
      "type": "tool.call",
      "lamport": 6,
      "seq": 6,
      "timestamp": "2026-08-10T09:00:10Z",
      "depends_on": [
        "evt_005"
      ],
      "payload": {
        "tool": "read_file",
        "arguments": {
          "path": "tests/test_auth.py"
        },
        "call_id": "call_001"
      }
    },
    {
      "event_id": "evt_007",
      "writer_id": "wsm:agent",
      "space_id": "root",
      "type": "tool.result",
      "lamport": 7,
      "seq": 7,
      "timestamp": "2026-08-10T09:00:11Z",
      "depends_on": [
        "evt_006"
      ],
      "payload": {
        "status": "success",
        "output": "def test_login():\n    token = login(seed=random.random())\n    assert token.valid\n",
        "call_id": "call_001",
        "raw": {
          "exit_code": 0
        }
      }
    },
    {
      "event_id": "evt_008",
      "writer_id": "wsm:agent",
      "space_id": "root",
      "type": "plan.update",
      "lamport": 8,
      "seq": 8,
      "timestamp": "2026-08-10T09:00:15Z",
      "depends_on": [
        "evt_007"
      ],
      "payload": {
        "steps": [
          {
            "title": "Locate source of nondeterminism",
            "status": "completed"
          },
          {
            "title": "Pin the random seed in test setup",
            "status": "in_progress"
          },
          {
            "title": "Re-run the suite to confirm stability",
            "status": "pending"
          }
        ]
      }
    },
    {
      "event_id": "evt_009",
      "writer_id": "wsm:agent",
      "space_id": "root",
      "type": "context.summary",
      "lamport": 9,
      "seq": 9,
      "timestamp": "2026-08-10T09:00:20Z",
      "depends_on": [
        "evt_008"
      ],
      "payload": {
        "summary": "User reported an intermittently failing auth test. Prior-session context and the test source both point at an unseeded RNG; plan is to pin the seed and re-run the suite.",
        "covers": {
          "from_event_id": "evt_002",
          "to_event_id": "evt_008"
        }
      }
    },
    {
      "event_id": "evt_010",
      "writer_id": "wsm:agent",
      "space_id": "root",
      "type": "session.end",
      "lamport": 10,
      "seq": 10,
      "timestamp": "2026-08-10T09:00:25Z",
      "depends_on": [
        "evt_009"
      ],
      "payload": {
        "reason": "completed",
        "session_id": "sess_2026_08_10_001"
      }
    }
  ],
  "export": {
    "kind": "full",
    "determinism": "full"
  }
}
