{
  "owsf_version": "1.0",
  "doc_id": "owsf_demo_2026_03_04_001",
  "created_at": "2026-03-04T00:00:00Z",
  "producer": {
    "name": "wsm",
    "version": "0.1.0"
  },
  "writers": [
    {
      "writer_id": "wsm:user"
    }
  ],
  "spaces": [
    {
      "id": "root",
      "type": "filesystem",
      "parent": null,
      "boundary": {
        "kind": "local_path",
        "ref": "/workspace"
      },
      "capabilities": [
        "read",
        "write"
      ],
      "trust_level": "trusted"
    }
  ],
  "events": [
    {
      "event_id": "evt_001",
      "writer_id": "wsm:user",
      "type": "topology.space_create",
      "space_id": "root",
      "lamport": 1,
      "seq": 1,
      "timestamp": "2026-03-04T00:00:00Z",
      "payload": {
        "note": "initial root space"
      }
    }
  ],
  "export": {
    "kind": "full",
    "determinism": "full"
  }
}
